Query,Kode,SurahNo,AyahNo,ArabicText,IndonesianText
haram dan larangan,b,6,26,وَهُمْ يَنْهَوْنَ عَنْهُ وَيَنْـَٔوْنَ عَنْهُ ۚوَاِنْ يُّهْلِكُوْنَ اِلَّآ اَنْفُسَهُمْ وَمَا يَشْعُرُوْنَ,"Mereka melarang (orang lain) mendengarkannya (Al-Qur’an) dan mereka pun menjauhkan diri darinya. Mereka tidak membinasakan kecuali diri mereka sendiri, tetapi mereka tidak menyadari."
haram dan larangan,ac,6,146,وَعَلَى الَّذِيْنَ هَادُوْا حَرَّمْنَا كُلَّ ذِيْ ظُفُرٍۚ وَمِنَ الْبَقَرِ وَالْغَنَمِ حَرَّمْنَا عَلَيْهِمْ شُحُوْمَهُمَآ اِلَّا مَا حَمَلَتْ ظُهُوْرُهُمَآ اَوِ الْحَوَايَآ اَوْ مَا اخْتَلَطَ بِعَظْمٍۗ ذٰلِكَ جَزَيْنٰهُمْ بِبَغْيِهِمْۚ وَاِنَّا لَصٰدِقُوْنَ,"Atas orang-orang Yahudi Kami mengharamkan semua (hewan) yang berkuku.265) Kami mengharamkan pula atas mereka lemak sapi dan domba, kecuali yang melekat di punggungnya, yang ada dalam isi perutnya, atau yang bercampur dengan tulang. Demikianlah Kami menghukum mereka karena kedurhakaannya. Sesungguhnya Kami Maha Benar"
haram dan larangan,a,9,29,قَاتِلُوا الَّذِيْنَ لَا يُؤْمِنُوْنَ بِاللّٰهِ وَلَا بِالْيَوْمِ الْاٰخِرِ وَلَا يُحَرِّمُوْنَ مَا حَرَّمَ اللّٰهُ وَرَسُوْلُهٗ وَلَا يَدِيْنُوْنَ دِيْنَ الْحَقِّ مِنَ الَّذِيْنَ اُوْتُوا الْكِتٰبَ حَتّٰى يُعْطُوا الْجِزْيَةَ عَنْ يَّدٍ وَّهُمْ صٰغِرُوْنَ ࣖ,"Perangilah orang-orang yang tidak beriman kepada Allah dan hari akhir, tidak mengharamkan (menjauhi) apa yang telah diharamkan (oleh) Allah dan Rasul-Nya, dan tidak mengikuti agama yang hak (Islam), yaitu orang-orang yang telah diberikan Kitab (Yahudi dan Nasrani) hingga mereka membayar jizyah323) dengan patuh dan mereka tunduk.324)"
haram dan larangan,c,9,37,اِنَّمَا النَّسِيْۤءُ زِيَادَةٌ فِى الْكُفْرِ يُضَلُّ بِهِ الَّذِيْنَ كَفَرُوْا يُحِلُّوْنَهٗ عَامًا وَّيُحَرِّمُوْنَهٗ عَامًا لِّيُوَاطِـُٔوْا عِدَّةَ مَا حَرَّمَ اللّٰهُ فَيُحِلُّوْا مَا حَرَّمَ اللّٰهُ ۗزُيِّنَ لَهُمْ سُوْۤءُ اَعْمَالِهِمْۗ وَاللّٰهُ لَا يَهْدِى الْقَوْمَ الْكٰفِرِيْنَ ࣖ,"Sesungguhnya pengunduran (bulan haram) itu hanya menambah kekufuran. Orang-orang yang kufur disesatkan dengan (pengunduran) itu, mereka menghalalkannya suatu tahun dan mengharamkannya pada suatu tahun yang lain agar mereka dapat menyesuaikan dengan bilangan yang diharamkan Allah, sehingga mereka menghalalkan apa yang diharamkan Allah. (Oleh setan) telah dijadikan terasa indah bagi mereka perbuatan-perbuatan buruk mereka itu. Allah tidak memberi petunjuk kepada kaum yang kafir."
haram dan larangan,b,17,38,كُلُّ ذٰلِكَ كَانَ سَيِّئُهٗ عِنْدَ رَبِّكَ مَكْرُوْهًا,Kejahatan dari semua (larangan) itu429) dibenci di sisi Tuhanmu.
haram dan larangan,ac,22,33,لَكُمْ فِيْهَا مَنَافِعُ اِلٰٓى اَجَلٍ مُّسَمًّى ثُمَّ مَحِلُّهَآ اِلَى الْبَيْتِ الْعَتِيْقِ ࣖ,"Bagi kamu padanya (hewan hadyu)502) ada beberapa manfaat,503) sampai waktu yang ditentukan, kemudian tempat penyembelihannya berada di sekitar al-Bait al-‘Atīq (Tanah Haram seluruhnya)."
haram dan larangan,b,26,167,قَالُوْا لَىِٕنْ لَّمْ تَنْتَهِ يٰلُوْطُ لَتَكُوْنَنَّ مِنَ الْمُخْرَجِيْنَ,"Mereka menjawab, “Wahai Lut, jika tidak berhenti (melarang kami), niscaya engkau benar-benar akan termasuk orang-orang yang diusir.”"
haram dan larangan,abc,56,33,لَّا مَقْطُوْعَةٍ وَّلَا مَمْنُوْعَةٍۙ,"yang tidak berhenti berbuah dan tidak terlarang memetiknya,"
haram dan larangan,ac,89,19,وَتَأْكُلُوْنَ التُّرَاثَ اَكْلًا لَّمًّاۙ,"memakan harta warisan dengan cara mencampurbaurkan (yang halal dan yang haram),"
haram dan larangan,b,96,9,اَرَاَيْتَ الَّذِيْ يَنْهٰىۙ,Tahukah kamu tentang orang yang melarang
hari kiamat,a,15,38,اِلٰى يَوْمِ الْوَقْتِ الْمَعْلُوْمِ,sampai hari yang telah ditentukan waktunya (kiamat).”
hari kiamat,abc,38,81,اِلٰى يَوْمِ الْوَقْتِ الْمَعْلُوْمِ,sampai hari yang telah ditentukan waktunya (kiamat).”
hari kiamat,ab,56,1,اِذَا وَقَعَتِ الْوَاقِعَةُۙ,"Apabila terjadi hari Kiamat (yang pasti terjadi),"
hari kiamat,ab,69,1,اَلْحَاۤقَّةُۙ,Al-Ḥāqqah (hari Kiamat yang pasti datang).
hari kiamat,ac,69,15,فَيَوْمَىِٕذٍ وَّقَعَتِ الْوَاقِعَةُۙ,pada hari itu terjadilah kiamat.
hari kiamat,bc,75,6,يَسْـَٔلُ اَيَّانَ يَوْمُ الْقِيٰمَةِۗ,"Dia bertanya, “Kapankah hari Kiamat itu?”"
hari kiamat,c,83,5,لِيَوْمٍ عَظِيْمٍۙ,"pada suatu hari yang besar (Kiamat),"
hari kiamat,bc,101,1,اَلْقَارِعَةُۙ,Al-Qāri‘ah (hari Kiamat yang menggetarkan).
jin,ac,17,88,قُلْ لَّىِٕنِ اجْتَمَعَتِ الْاِنْسُ وَالْجِنُّ عَلٰٓى اَنْ يَّأْتُوْا بِمِثْلِ هٰذَا الْقُرْاٰنِ لَا يَأْتُوْنَ بِمِثْلِهٖ وَلَوْ كَانَ بَعْضُهُمْ لِبَعْضٍ ظَهِيْرًا,"Katakanlah, “Sungguh, jika manusia dan jin berkumpul untuk mendatangkan yang serupa dengan Al-Qur’an ini, mereka tidak akan dapat mendatangkan yang serupa dengannya, sekalipun mereka membantu satu sama lainnya.”"
jin,ac,55,31,سَنَفْرُغُ لَكُمْ اَيُّهَ الثَّقَلٰنِۚ,"Kami akan mencurahkan perhatian kepadamu, wahai manusia dan jin."
jin,b,55,39,فَيَوْمَئِذٍ لَّا يُسْـَٔلُ عَنْ ذَنْۢبِهٖٓ اِنْسٌ وَّلَا جَاۤنٌّۚ,"Maka, pada hari itu manusia dan jin tidak ditanya tentang dosanya706)"
jin,abc,55,74,لَمْ يَطْمِثْهُنَّ اِنْسٌ قَبْلَهُمْ وَلَا جَاۤنٌّۚ,Mereka tidak pernah disentuh oleh manusia sebelum mereka dan tidak (pula) oleh jin.
jin,abc,72,8,وَّاَنَّا لَمَسْنَا السَّمَاۤءَ فَوَجَدْنٰهَا مُلِئَتْ حَرَسًا شَدِيْدًا وَّشُهُبًاۖ,"(Jin berkata lagi,) “Sesungguhnya kami (jin) telah mencoba mengetahui (rahasia) langit. Maka, kami mendapatinya penuh dengan penjagaan yang kuat dan panah-panah api."
jin,b,72,19,وَّاَنَّهٗ لَمَّا قَامَ عَبْدُ اللّٰهِ يَدْعُوْهُ كَادُوْا يَكُوْنُوْنَ عَلَيْهِ لِبَدًاۗ ࣖ,"Sesungguhnya ketika hamba Allah (Nabi Muhammad) berdiri menyembah-Nya (melaksanakan salat), mereka (jin-jin) itu berdesakan mengerumuninya."
jin,abc,114,6,مِنَ الْجِنَّةِ وَالنَّاسِ ࣖ,dari (golongan) jin dan manusia.”
nabi ibrahim,b,3,68,اِنَّ اَوْلَى النَّاسِ بِاِبْرٰهِيْمَ لَلَّذِيْنَ اتَّبَعُوْهُ وَهٰذَا النَّبِيُّ وَالَّذِيْنَ اٰمَنُوْا ۗ وَاللّٰهُ وَلِيُّ الْمُؤْمِنِيْنَ,"Sesungguhnya orang yang paling dekat dengan Ibrahim adalah orang-orang yang mengikutinya, Nabi ini (Nabi Muhammad), dan orang-orang yang beriman. Allah adalah pelindung orang-orang mukmin."
nabi ibrahim,abc,9,114,وَمَا كَانَ اسْتِغْفَارُ اِبْرٰهِيْمَ لِاَبِيْهِ اِلَّا عَنْ مَّوْعِدَةٍ وَّعَدَهَآ اِيَّاهُۚ فَلَمَّا تَبَيَّنَ لَهٗٓ اَنَّهٗ عَدُوٌّ لِّلّٰهِ تَبَرَّاَ مِنْهُۗ اِنَّ اِبْرٰهِيْمَ لَاَوَّاهٌ حَلِيْمٌ,"Adapun permohonan ampunan Ibrahim (kepada Allah) untuk bapaknya,336) tidak lain hanyalah karena suatu janji yang telah dia ikrarkan kepadanya. Maka, ketika jelas baginya (Ibrahim) bahwa dia (bapaknya) adalah musuh Allah, dia (Ibrahim) berlepas diri darinya. Sesungguhnya Ibrahim benar-benar seorang yang sangat lembut hatinya lagi penyantun."
nabi ibrahim,ac,16,123,ثُمَّ اَوْحَيْنَآ اِلَيْكَ اَنِ اتَّبِعْ مِلَّةَ اِبْرٰهِيْمَ حَنِيْفًا ۗوَمَا كَانَ مِنَ الْمُشْرِكِيْنَ,"Kemudian, Kami wahyukan kepadamu (Nabi Muhammad), “Ikutilah agama Ibrahim sebagai (sosok) yang hanif dan tidak termasuk orang-orang musyrik.”"
nabi ibrahim,abc,19,41,وَاذْكُرْ فِى الْكِتٰبِ اِبْرٰهِيْمَ ەۗ اِنَّهٗ كَانَ صِدِّيْقًا نَّبِيًّا,"Ceritakanlah (Nabi Muhammad, kisah) Ibrahim di dalam Kitab (Al-Qur’an)! Sesungguhnya dia adalah seorang yang sangat benar dan membenarkan lagi seorang nabi."
nabi ibrahim,abc,29,26,۞ فَاٰمَنَ لَهٗ لُوْطٌۘ وَقَالَ اِنِّيْ مُهَاجِرٌ اِلٰى رَبِّيْ ۗاِنَّهٗ هُوَ الْعَزِيْزُ الْحَكِيْمُ,"Maka, Lut membenarkan (kenabian Ibrahim). Dia (Ibrahim) pun berkata, “Sesungguhnya aku berhijrah ke (tempat yang diperintahkan) Tuhanku. Sesungguhnya Dialah Yang Maha Perkasa lagi Maha Bijaksana.”"
nabi ibrahim,abc,37,109,سَلٰمٌ عَلٰٓى اِبْرٰهِيْمَ,“Salam sejahtera atas Ibrahim.”
nabi isa,c,4,157,وَّقَوْلِهِمْ اِنَّا قَتَلْنَا الْمَسِيْحَ عِيْسَى ابْنَ مَرْيَمَ رَسُوْلَ اللّٰهِۚ وَمَا قَتَلُوْهُ وَمَا صَلَبُوْهُ وَلٰكِنْ شُبِّهَ لَهُمْ ۗوَاِنَّ الَّذِيْنَ اخْتَلَفُوْا فِيْهِ لَفِيْ شَكٍّ مِّنْهُ ۗمَا لَهُمْ بِهٖ مِنْ عِلْمٍ اِلَّا اتِّبَاعَ الظَّنِّ وَمَا قَتَلُوْهُ يَقِيْنًاۢ ۙ,"(Kami menghukum pula mereka) karena ucapan mereka, “Sesungguhnya kami telah membunuh Almasih, Isa putra Maryam, Rasul Allah,”184) padahal mereka tidak membunuhnya dan tidak (pula) menyalibnya, tetapi (yang mereka bunuh adalah) orang yang menurut mereka menyerupai (Isa). Sesungguhnya mereka yang berselisih pendapat tentangnya (pembunuhan Isa), selalu dalam keragu-raguan terhadapnya. Mereka benar-benar tidak mengetahui (siapa sebenarnya yang dibunuh itu), kecuali mengikuti persangkaan belaka. (Jadi,) mereka tidak yakin telah membunuhnya."
nabi isa,abc,4,159,وَاِنْ مِّنْ اَهْلِ الْكِتٰبِ اِلَّا لَيُؤْمِنَنَّ بِهٖ قَبْلَ مَوْتِهٖ ۚوَيَوْمَ الْقِيٰمَةِ يَكُوْنُ عَلَيْهِمْ شَهِيْدًاۚ,"Tidak ada seorang pun di antara Ahlulkitab, kecuali beriman kepadanya (Isa) menjelang kematiannya.186) Pada hari Kiamat dia (Isa) akan menjadi saksi mereka."
nabi isa,abc,5,112,اِذْ قَالَ الْحَوَارِيُّوْنَ يٰعِيْسَى ابْنَ مَرْيَمَ هَلْ يَسْتَطِيْعُ رَبُّكَ اَنْ يُّنَزِّلَ عَلَيْنَا مَاۤىِٕدَةً مِّنَ السَّمَاۤءِ ۗقَالَ اتَّقُوا اللّٰهَ اِنْ كُنْتُمْ مُّؤْمِنِيْنَ,"(Ingatlah) ketika para pengikut setia Isa berkata, “Wahai Isa putra Maryam, sanggupkah (bersediakah) Tuhanmu menurunkan hidangan dari langit kepada kami?” Isa menjawab, “Bertak-walah kepada Allah jika kamu orang-orang mukmin.”"
nabi isa,ab,5,116,وَاِذْ قَالَ اللّٰهُ يٰعِيْسَى ابْنَ مَرْيَمَ ءَاَنْتَ قُلْتَ لِلنَّاسِ اتَّخِذُوْنِيْ وَاُمِّيَ اِلٰهَيْنِ مِنْ دُوْنِ اللّٰهِ ۗقَالَ سُبْحٰنَكَ مَا يَكُوْنُ لِيْٓ اَنْ اَقُوْلَ مَا لَيْسَ لِيْ بِحَقٍّ ۗاِنْ كُنْتُ قُلْتُهٗ فَقَدْ عَلِمْتَهٗ ۗتَعْلَمُ مَا فِيْ نَفْسِيْ وَلَآ اَعْلَمُ مَا فِيْ نَفْسِكَ ۗاِنَّكَ اَنْتَ عَلَّامُ الْغُيُوْبِ,"(Ingatlah) ketika Allah berfirman, “Wahai Isa putra Maryam, apakah engkau mengatakan kepada orang-orang, ‘Jadikanlah aku dan ibuku sebagai dua tuhan selain Allah?’” Dia (Isa) menjawab, “Maha Suci Engkau, tidak patut bagiku mengatakan apa pun yang bukan hakku. Jika aku pernah mengatakannya tentulah Engkau telah mengetahuinya. Engkau mengetahui apa pun yang ada pada diriku dan aku tidak mengetahui apa pun yang ada pada diri-Mu. Sungguh, Engkaulah Yang Maha Mengetahui segala yang gaib.”"
nabi isa,abc,19,30,قَالَ اِنِّيْ عَبْدُ اللّٰهِ ۗاٰتٰىنِيَ الْكِتٰبَ وَجَعَلَنِيْ نَبِيًّا ۙ,"Dia (Isa) berkata, “Sesungguhnya aku hamba Allah. Dia (akan) memberiku Kitab (Injil) dan menjadikan aku seorang nabi."
nabi isa,abc,43,59,اِنْ هُوَ اِلَّا عَبْدٌ اَنْعَمْنَا عَلَيْهِ وَجَعَلْنٰهُ مَثَلًا لِّبَنِيْٓ اِسْرَاۤءِيْلَ ۗ,Dia (Isa) tidak lain hanyalah seorang hamba yang Kami anugerahkan nikmat (kenabian) kepadanya dan Kami jadikan dia sebagai pelajaran (tanda kekuasaan Kami) bagi Bani Israil.
nabi musa,ac,17,101,وَلَقَدْ اٰتَيْنَا مُوْسٰى تِسْعَ اٰيٰتٍۢ بَيِّنٰتٍ فَسْـَٔلْ بَنِيْٓ اِسْرَاۤءِيْلَ اِذْ جَاۤءَهُمْ فَقَالَ لَهٗ فِرْعَوْنُ اِنِّيْ لَاَظُنُّكَ يٰمُوْسٰى مَسْحُوْرًا,"Sungguh, Kami telah menganugerahkan kepada Musa sembilan mukjizat yang nyata.440) Maka, tanyakanlah kepada Bani Israil ketika dia datang kepada mereka lalu Fir‘aun berkata kepadanya, “Sesungguhnya aku benar-benar yakin bahwa engkau, wahai Musa, terkena sihir.”"
nabi musa,abc,18,76,قَالَ اِنْ سَاَلْتُكَ عَنْ شَيْءٍۢ بَعْدَهَا فَلَا تُصٰحِبْنِيْۚ قَدْ بَلَغْتَ مِنْ لَّدُنِّيْ عُذْرًا,"Dia (Musa) berkata, “Jika aku bertanya kepadamu tentang sesuatu setelah ini, jangan lagi engkau memperbolehkan aku menyertaimu. Sungguh engkau telah mencapai batas (yang wajar dalam) memberikan uzur (maaf) kepadaku.”"
nabi musa,abc,20,17,وَمَا تِلْكَ بِيَمِيْنِكَ يٰمُوْسٰى,"Apa yang ada di tangan kananmu itu, wahai Musa?”"
nabi musa,b,20,66,قَالَ بَلْ اَلْقُوْاۚ فَاِذَا حِبَالُهُمْ وَعِصِيُّهُمْ يُخَيَّلُ اِلَيْهِ مِنْ سِحْرِهِمْ اَنَّهَا تَسْعٰى,"Dia (Musa) berkata, “Silakan kamu melemparkan!” Tiba-tiba tali-temali dan tongkat-tongkat mereka terbayang olehnya (Musa) seakan-akan ia (ular-ular itu) merayap cepat karena sihir mereka."
nabi musa,abc,20,67,فَاَوْجَسَ فِيْ نَفْسِهٖ خِيْفَةً مُّوْسٰى,"Maka, terlintaslah dalam hati Musa (perasaan) takut."
nabi musa,abc,26,65,وَاَنْجَيْنَا مُوْسٰى وَمَنْ مَّعَهٗٓ اَجْمَعِيْنَ ۚ,Kami selamatkan Musa dan semua orang yang bersamanya.
neraka,abc,37,127,فَكَذَّبُوْهُ فَاِنَّهُمْ لَمُحْضَرُوْنَۙ,"Mereka kemudian mendustakannya (Ilyas). Sesungguhnya mereka akan diseret (ke neraka),"
neraka,abc,74,27,وَمَآ اَدْرٰىكَ مَا سَقَرُۗ,Tahukah kamu apa (neraka) Saqar itu?
neraka,abc,82,16,وَمَا هُمْ عَنْهَا بِغَاۤىِٕبِيْنَۗ,Mereka tidak mungkin keluar dari (neraka) itu.
neraka,abc,101,10,وَمَآ اَدْرٰىكَ مَا هِيَهْۗ,Tahukah kamu apakah (neraka Hawiyah) itu?
neraka,abc,104,5,وَمَآ اَدْرٰىكَ مَا الْحُطَمَةُ ۗ,Tahukah kamu apakah (neraka) Hutamah?
orang munafik,c,4,66,وَلَوْ اَنَّا كَتَبْنَا عَلَيْهِمْ اَنِ اقْتُلُوْٓا اَنْفُسَكُمْ اَوِ اخْرُجُوْا مِنْ دِيَارِكُمْ مَّا فَعَلُوْهُ اِلَّا قَلِيْلٌ مِّنْهُمْ ۗوَلَوْ اَنَّهُمْ فَعَلُوْا مَا يُوْعَظُوْنَ بِهٖ لَكَانَ خَيْرًا لَّهُمْ وَاَشَدَّ تَثْبِيْتًاۙ,"Seandainya Kami perintahkan kepada mereka (orang-orang munafik), “Bunuhlah dirimu atau keluarlah kamu dari kampung halamanmu,” niscaya mereka tidak akan melakukannya, kecuali sebagian kecil dari mereka. Seandainya mereka melaksanakan pengajaran yang diberikan kepada mereka, sungguh itu lebih baik bagi mereka dan lebih menguatkan (iman mereka)."
orang munafik,abc,9,67,اَلْمُنٰفِقُوْنَ وَالْمُنٰفِقٰتُ بَعْضُهُمْ مِّنْۢ بَعْضٍۘ يَأْمُرُوْنَ بِالْمُنْكَرِ وَيَنْهَوْنَ عَنِ الْمَعْرُوْفِ وَيَقْبِضُوْنَ اَيْدِيَهُمْۗ نَسُوا اللّٰهَ فَنَسِيَهُمْ ۗ اِنَّ الْمُنٰفِقِيْنَ هُمُ الْفٰسِقُوْنَ,"Orang-orang munafik laki-laki dan perempuan, satu dengan yang lain (adalah sama saja). Mereka menyuruh (berbuat) mungkar dan mencegah (berbuat) makruf. Mereka pun menggenggam tangannya (kikir). Mereka telah melupakan Allah, maka Allah melupakan mereka. Sesungguhnya orang-orang munafik adalah orang-orang yang fasik."
orang munafik,abc,9,101,وَمِمَّنْ حَوْلَكُمْ مِّنَ الْاَعْرَابِ مُنٰفِقُوْنَ ۗوَمِنْ اَهْلِ الْمَدِيْنَةِ مَرَدُوْا عَلَى النِّفَاقِۗ لَا تَعْلَمُهُمْۗ نَحْنُ نَعْلَمُهُمْۗ سَنُعَذِّبُهُمْ مَّرَّتَيْنِ ثُمَّ يُرَدُّوْنَ اِلٰى عَذَابٍ عَظِيْمٍ ۚ,"Di antara orang-orang Arab Badui yang (tinggal) di sekitarmu ada orang-orang munafik. (Demikian pula) di antara penduduk Madinah (ada juga orang-orang munafik), mereka keterlaluan dalam kemunafikannya. Engkau (Nabi Muhammad) tidak mengetahui mereka, tetapi Kami mengetahuinya. Mereka akan Kami siksa dua kali,331) kemudian mereka akan dikembalikan kepada azab yang besar."
orang munafik,abc,9,126,اَوَلَا يَرَوْنَ اَنَّهُمْ يُفْتَنُوْنَ فِيْ كُلِّ عَامٍ مَّرَّةً اَوْ مَرَّتَيْنِ ثُمَّ لَا يَتُوْبُوْنَ وَلَا هُمْ يَذَّكَّرُوْنَ,"Tidakkah mereka (orang-orang munafik) memperhatikan bahwa mereka diuji sekali atau dua kali setiap tahun, tetapi mereka tidak (juga) bertobat dan tidak (pula) mengambil pelajaran?"
orang munafik,abc,29,11,وَلَيَعْلَمَنَّ اللّٰهُ الَّذِيْنَ اٰمَنُوْا وَلَيَعْلَمَنَّ الْمُنٰفِقِيْنَ,Allah pasti mengetahui orang-orang yang beriman dan Dia pasti mengetahui orang-orang munafik.
orang munafik,a,57,14,يُنَادُوْنَهُمْ اَلَمْ نَكُنْ مَّعَكُمْۗ قَالُوْا بَلٰى وَلٰكِنَّكُمْ فَتَنْتُمْ اَنْفُسَكُمْ وَتَرَبَّصْتُمْ وَارْتَبْتُمْ وَغَرَّتْكُمُ الْاَمَانِيُّ حَتّٰى جَاۤءَ اَمْرُ اللّٰهِ وَغَرَّكُمْ بِاللّٰهِ الْغَرُوْرُ,"Orang-orang (munafik) memanggil mereka (orang-orang beriman), “Bukankah kami dahulu bersama kamu?” Mereka menjawab, “Benar, tetapi kamu mencelakakan dirimu sendiri (dengan kemunafikan), menunggu-nunggu (kebinasaan kami), meragukan (ajaran Islam), dan ditipu oleh angan-angan kosong sampai datang ketetapan Allah. (Setan) penipu memperdayakanmu (sehingga kamu lalai) terhadap Allah."
orang munafik,b,59,12,لَىِٕنْ اُخْرِجُوْا لَا يَخْرُجُوْنَ مَعَهُمْۚ وَلَىِٕنْ قُوْتِلُوْا لَا يَنْصُرُوْنَهُمْۚ وَلَىِٕنْ نَّصَرُوْهُمْ لَيُوَلُّنَّ الْاَدْبَارَۙ ثُمَّ لَا يُنْصَرُوْنَ,"Jika mereka benar-benar diusir, orang-orang (munafik) itu tidak akan keluar bersama mereka. Jika mereka benar-benar diperangi, orang-orang (munafik) itu tidak akan menolongnya. Kalaupun menolongnya, niscaya orang-orang (munafik) itu akan berpaling (untuk lari) ke belakang, kemudian mereka tidak akan ditolong."
petunjuk,abc,2,16,اُولٰۤىِٕكَ الَّذِيْنَ اشْتَرَوُا الضَّلٰلَةَ بِالْهُدٰىۖ فَمَا رَبِحَتْ تِّجَارَتُهُمْ وَمَا كَانُوْا مُهْتَدِيْنَ,"Mereka itulah orang-orang yang membeli kesesatan dengan petunjuk. Maka, tidaklah beruntung perniagaannya dan mereka bukanlah orang-orang yang mendapatkan petunjuk."
petunjuk,abc,28,56,اِنَّكَ لَا تَهْدِيْ مَنْ اَحْبَبْتَ وَلٰكِنَّ اللّٰهَ يَهْدِيْ مَنْ يَّشَاۤءُ ۚوَهُوَ اَعْلَمُ بِالْمُهْتَدِيْنَ,"Sesungguhnya engkau (Nabi Muhammad) tidak (akan dapat) memberi petunjuk kepada orang yang engkau kasihi, tetapi Allah memberi petunjuk kepada siapa yang Dia kehendaki (berdasarkan kesiapannya untuk menerima petunjuk). Dia paling tahu tentang orang-orang yang (mau) menerima petunjuk."
petunjuk,abc,47,17,وَالَّذِيْنَ اهْتَدَوْا زَادَهُمْ هُدًى وَّاٰتٰىهُمْ تَقْوٰىهُمْ,Orang-orang yang mendapat petunjuk akan ditambahi petunjuk(-nya) dan dianugerahi ketakwaan (oleh Allah).
petunjuk,abc,87,3,وَالَّذِيْ قَدَّرَ فَهَدٰىۖ,"yang menentukan kadar (masing-masing) dan memberi petunjuk,"
petunjuk,abc,92,12,اِنَّ عَلَيْنَا لَلْهُدٰىۖ,Sesungguhnya Kamilah yang (berhak) memberi petunjuk.
rezeki dari Allah,c,16,71,وَاللّٰهُ فَضَّلَ بَعْضَكُمْ عَلٰى بَعْضٍ فِى الرِّزْقِۚ فَمَا الَّذِيْنَ فُضِّلُوْا بِرَاۤدِّيْ رِزْقِهِمْ عَلٰى مَا مَلَكَتْ اَيْمَانُهُمْ فَهُمْ فِيْهِ سَوَاۤءٌۗ اَفَبِنِعْمَةِ اللّٰهِ يَجْحَدُوْنَ,"Allah melebihkan sebagian kamu atas sebagian yang lain dalam hal rezeki. Akan tetapi, orang-orang yang dilebihkan (rezekinya itu) tidak mau memberikan rezekinya kepada para hamba sahaya yang mereka miliki sehingga mereka sama-sama (merasakan) rezeki itu. Mengapa terhadap nikmat Allah mereka ingkar?"
rezeki dari Allah,a,20,132,وَأْمُرْ اَهْلَكَ بِالصَّلٰوةِ وَاصْطَبِرْ عَلَيْهَاۗ لَا نَسْـَٔلُكَ رِزْقًاۗ نَحْنُ نَرْزُقُكَۗ وَالْعَاقِبَةُ لِلتَّقْوٰى,Perintahkanlah keluargamu melaksanakan salat dan bersabarlah dengan sungguh-sungguh dalam mengerjakannya. Kami tidak meminta rezeki kepadamu. Kamilah yang memberi rezeki kepadamu. Kesudahan (yang baik di dunia dan akhirat) adalah bagi orang yang bertakwa.
rezeki dari Allah,b,28,82,وَاَصْبَحَ الَّذِيْنَ تَمَنَّوْا مَكَانَهٗ بِالْاَمْسِ يَقُوْلُوْنَ وَيْكَاَنَّ اللّٰهَ يَبْسُطُ الرِّزْقَ لِمَنْ يَّشَاۤءُ مِنْ عِبَادِهٖ وَيَقْدِرُۚ لَوْلَآ اَنْ مَّنَّ اللّٰهُ عَلَيْنَا لَخَسَفَ بِنَا ۗوَيْكَاَنَّهٗ لَا يُفْلِحُ الْكٰفِرُوْنَ ࣖ,"Orang-orang yang kemarin mengangan-angankan kedudukannya (Qarun) itu berkata, “Aduhai, benarlah Allah melapangkan rezeki bagi siapa yang Dia kehendaki dari para hamba-Nya dan Dia (juga) yang menyempitkan (rezeki bagi mereka). Seandainya Allah tidak melimpahkan karunia-Nya pada kita, tentu Dia telah membenamkan kita pula. Aduhai, benarlah tidak akan beruntung orang-orang yang ingkar (terhadap nikmat).”"
rezeki dari Allah,abc,37,41,اُولٰۤىِٕكَ لَهُمْ رِزْقٌ مَّعْلُوْمٌۙ,"mereka itu memperoleh rezeki yang sudah ditentukan,"
rezeki dari Allah,abc,51,22,وَفِى السَّمَاۤءِ رِزْقُكُمْ وَمَا تُوْعَدُوْنَ,Di langit terdapat pula (hujan yang menjadi sebab) rezekimu dan apa yang dijanjikan kepadamu.
rezeki dari Allah,abc,51,57,مَآ اُرِيْدُ مِنْهُمْ مِّنْ رِّزْقٍ وَّمَآ اُرِيْدُ اَنْ يُّطْعِمُوْنِ,Aku tidak menghendaki rezeki sedikit pun dari mereka dan tidak menghendaki agar mereka memberi makan kepada-Ku.
rezeki dari Allah,abc,67,21,اَمَّنْ هٰذَا الَّذِيْ يَرْزُقُكُمْ اِنْ اَمْسَكَ رِزْقَهٗ ۚ بَلْ لَّجُّوْا فِيْ عُتُوٍّ وَّنُفُوْرٍ,"Atau, siapakah yang dapat memberimu rezeki jika Dia menahan rezeki-Nya? Sebaliknya, mereka terus-menerus dalam kesombongan dan menjauhkan diri (dari kebenaran)."
